{
  "$schema": "https://json-schema.org/draft/2020-12/schema",
  "title": "Fridolin config.json",
  "description": "The bridge's configuration, version 2, as docs/CONFIGURATION.md describes it. A file without \"version\", or with null, is version 1, which may also have the retired keys model, work_dir and brains. Every key is optional: the bridge fills in a default for each one left out. Keys are added in later versions without a new version; one renamed, removed or given another meaning comes with a new version.",
  "type": "object",
  "additionalProperties": false,
  "anyOf": [
    {"properties": {"version": {"enum": [1, null]}}},
    {"not": {"anyOf": [{"required": ["model"]}, {"required": ["work_dir"]}, {"required": ["brains"]}]}}
  ],
  "properties": {
    "_comment": {"type": "string", "description": "A note for whoever reads the file; the bridge keeps it as it is."},
    "version": {"type": ["integer", "null"], "minimum": 1, "maximum": 2, "description": "The version of this file, written by the bridge on every save; absent or null is 1."},
    "allowed_numbers": {"type": ["array", "null"], "items": {"type": "string"}, "description": "Phone numbers, with the country code, that may DM the bridge."},
    "allow_any_dm": {"type": "boolean", "description": "true lets anyone DM while allowed_numbers is empty; unset or false lets nobody."},
    "allowed_groups": {"type": ["array", "null"], "items": {"type": "string"}, "description": "Group JIDs (…@g.us) the bridge answers in."},
    "group_members": {
      "type": "object",
      "description": "Who in an allowed group reaches its brain: by group JID, which allowed_groups must list too, the members' phone numbers, or [\"*\"] for every member.",
      "propertyNames": {"pattern": "^[0-9]+(-[0-9]+)?@g\\.us$"},
      "additionalProperties": {
        "oneOf": [
          {"const": ["*"]},
          {"type": "array", "items": {"$ref": "#/$defs/phone_number"}}
        ]
      }
    },
    "triggers": {
      "type": "array",
      "description": "Keywords that address the bridge in a group: a string matches anywhere, an object can say where.",
      "items": {
        "oneOf": [
          {"type": "string"},
          {
            "type": "object",
            "additionalProperties": false,
            "required": ["text"],
            "properties": {
              "text": {"type": "string"},
              "match": {"enum": ["", "anywhere", "start", "word"]}
            }
          }
        ]
      }
    },
    "claude_path": {"type": "string", "description": "The Claude Code CLI; \"claude\" looks it up on PATH."},
    "agent_provider": {"enum": ["", "claude", "codex"], "description": "The CLI for new brain runs; empty defaults to claude. Changes apply to the next run."},
    "codex_path": {"type": "string", "description": "The Codex CLI; empty defaults to codex on PATH."},
    "codex_model": {"type": "string", "description": "The model for all Codex runs; empty defaults to gpt-6.1-sol."},
    "codex_effort": {"enum": ["", "low", "medium", "high", "xhigh", "max"], "description": "Codex reasoning effort; empty defaults to high."},
    "data_dir": {"type": "string", "description": "The bridge's own data: bridge.db, media, tokens. Needs a restart."},
    "db_path": {"type": "string", "description": "Default <data_dir>/bridge.db. Needs a restart."},
    "media_dir": {"type": "string", "description": "Default <data_dir>/media. Needs a restart."},
    "max_chunk_size": {
      "type": "integer",
      "description": "The most characters in one outgoing message; 0 is the default, 3900.",
      "anyOf": [{"const": 0}, {"minimum": 100, "maximum": 65536}]
    },
    "max_media_mb": {"type": "integer", "minimum": 0, "maximum": 2048, "description": "The largest attachment downloaded, in MB; 0 is the default, 100."},
    "brain_model": {"type": "string", "description": "The model brains use unless they name their own; empty uses the CLI's default."},
    "brain_effort": {"enum": ["", "low", "medium", "high", "xhigh", "max"]},
    "disallowed_tools": {"type": "array", "items": {"type": "string"}, "description": "Passed to the CLI as --disallowed-tools; brains can override it."},
    "dangerously_skip_permissions": {"type": "boolean"},
    "run_timeout_minutes": {"type": "integer", "minimum": 0, "maximum": 1440, "description": "Stops a run that takes longer; 0 lets it run as long as it takes. Default 30."},
    "max_concurrent_runs": {"type": "integer", "minimum": 0, "maximum": 64, "description": "How many Claude runs may go at once, all brains together; 0 for no limit. Default 2."},
    "inherit_claude_user_config": {"type": "boolean"},
    "child_env_passthrough": {"type": "array", "items": {"type": "string", "pattern": "^[A-Za-z_][A-Za-z0-9_]*$"}, "description": "Variables of the bridge's environment that brains get too."},
    "http_listen": {
      "type": "string",
      "description": "The dashboard's and the script API's address, on loopback only, or \"off\". Needs a restart.",
      "pattern": "^$|^off$|^(127\\.[0-9]{1,3}\\.[0-9]{1,3}\\.[0-9]{1,3}|localhost|\\[::1\\]):[0-9]+$"
    },
    "log_level": {"enum": ["", "debug", "info", "warn", "error"], "description": "Needs a restart."},
    "brain_mode": {"const": true, "description": "Retired: brains always run. false is refused; the bridge writes true, for an older version rolled back to."},
    "brain_dirs": {
      "type": "array",
      "description": "The brain folders added in the dashboard, each with the brain.json you approved.",
      "items": {
        "type": "object",
        "additionalProperties": false,
        "required": ["path"],
        "properties": {
          "path": {"type": "string"},
          "approved": {"oneOf": [{"$ref": "brain.schema.json"}, {"type": "null"}]},
          "moved_from": {"type": "string", "description": "Where the folder lives on its home machine, while a core move keeps it in the volume; the move back brings it home."}
        }
      }
    },
    "sandbox": {
      "type": "object",
      "additionalProperties": false,
      "properties": {
        "enabled": {"type": "boolean", "description": "Runs brains in sandbox-exec on macOS, in bubblewrap in the fridolin-core container; refused elsewhere."},
        "deny_paths": {"type": ["array", "null"], "items": {"$ref": "#/$defs/absolute_path"}},
        "allow_paths": {"type": ["array", "null"], "items": {"$ref": "#/$defs/absolute_path"}},
        "git_config": {"enum": ["", "read", "deny"]},
        "credentials_dir": {"anyOf": [{"const": ""}, {"$ref": "#/$defs/absolute_path"}]}
      }
    },
    "otp_guard": {"type": "boolean"},
    "otp_markers": {"type": "array", "items": {"type": "string"}},
    "viewer": {"type": "boolean"},
    "queue": {
      "type": "object",
      "additionalProperties": false,
      "properties": {
        "mode": {"enum": ["", "queue", "interrupt"]},
        "max_pending": {"type": "integer", "description": "0 or less is the default, 10."},
        "notify": {"type": "boolean"}
      }
    },
    "debounce": {
      "type": "object",
      "additionalProperties": false,
      "properties": {
        "quiet_ms": {"type": "integer"},
        "max_wait_ms": {"type": "integer"}
      }
    },
    "ingest": {
      "type": "object",
      "additionalProperties": false,
      "properties": {
        "enabled": {"type": "boolean"}
      }
    },
    "startup_checks": {
      "type": "object",
      "additionalProperties": false,
      "properties": {
        "required_files": {"type": "array", "items": {"type": "string"}},
        "notify_whatsapp": {"type": "boolean"},
        "notify_jid": {"type": "string"},
        "hint": {"type": "string"}
      }
    },
    "backup": {
      "type": "object",
      "additionalProperties": false,
      "properties": {
        "enabled": {"type": "boolean"},
        "remote": {"type": "string", "pattern": "^$|^[A-Za-z0-9_-]{1,40}$"},
        "root": {"type": "string", "not": {"pattern": "^/|[:\\r\\n\\\\]|\\.\\."}},
        "daily_at": {"type": "string", "pattern": "^$|^([01][0-9]|2[0-3]):[0-5][0-9]$"},
        "rclone_path": {"type": "string"},
        "keep_versions_days": {"type": "integer", "minimum": 0, "description": "0 keeps versions forever. Default 30."},
        "include_bridge_config": {"type": "boolean"},
        "include_secret_files": {"type": "boolean", "description": "Also uploads .env files, private keys and tokens from brain folders. Default false."}
      }
    },
    "plaud": {
      "type": "object",
      "additionalProperties": false,
      "properties": {
        "enabled": {"type": "boolean"},
        "brain": {"type": "string", "pattern": "^$|^[a-z0-9][a-z0-9_-]{0,39}$"},
        "cli_path": {"type": "string"},
        "interval_seconds": {"type": "integer", "anyOf": [{"const": 0}, {"minimum": 30}]},
        "polished": {"type": "boolean"},
        "message": {"type": "string"},
        "brain_access": {"type": "boolean"},
        "phone_dir": {"anyOf": [{"const": ""}, {"$ref": "#/$defs/absolute_path"}]},
        "phone_upload": {"type": "boolean"}
      }
    },
    "dashboard": {
      "type": "object",
      "additionalProperties": false,
      "properties": {
        "disabled": {"type": "boolean", "description": "Needs a restart."},
        "require_token": {"type": "boolean", "description": "Default true. Turning it off needs a restart; turning it on applies at once."}
      }
    },
    "script_api": {
      "type": "object",
      "additionalProperties": false,
      "properties": {
        "tokenless_send": {"type": "boolean"}
      }
    },
    "core": {
      "type": "object",
      "additionalProperties": false,
      "description": "The containerized core. Off by default.",
      "properties": {
        "tailnet": {
          "type": "object",
          "additionalProperties": false,
          "properties": {
            "enabled": {"type": "boolean", "description": "Joins the tailnet as its own device (tsnet). Default false. Needs a restart."},
            "hostname": {"type": "string", "pattern": "^$|^[a-z0-9]([a-z0-9-]{0,61}[a-z0-9])?$", "description": "The core's name on the tailnet, one DNS label. Default fridolin-core. Needs a restart."}
          }
        },
        "lease": {
          "type": "object",
          "additionalProperties": false,
          "properties": {
            "enabled": {"type": "boolean", "description": "Takes and renews the core lease in the vault bucket. Default false. Needs a restart."},
            "renew_seconds": {"type": "integer", "minimum": 0, "maximum": 86400, "description": "Default 300. Needs a restart."},
            "stale_seconds": {"type": "integer", "minimum": 0, "maximum": 86400, "description": "Default 1200; must be more than renew_seconds. Needs a restart."}
          }
        },
        "memory_limit_gb": {"type": "integer", "minimum": 0, "maximum": 4096, "description": "Default 8."}
      }
    },
    "vault": {
      "type": "object",
      "additionalProperties": false,
      "description": "The tiered vault in Backblaze B2. Off by default.",
      "properties": {
        "enabled": {"type": "boolean"},
        "hot_budget_gb": {"type": "integer", "minimum": 0, "maximum": 1048576, "description": "Default 50."},
        "activity_days": {"type": "integer", "minimum": 0, "maximum": 36500, "description": "Default 60."},
        "cold_after_days": {"type": "integer", "minimum": 0, "maximum": 36500, "description": "Default 90."},
        "headroom_percent": {"type": "integer", "minimum": 0, "maximum": 90, "description": "Default 10."},
        "bucket": {"$ref": "#/$defs/bucket", "description": "Default fridolin-vault. Needs a restart."},
        "snapshots_bucket": {"$ref": "#/$defs/bucket", "description": "Default fridolin-snapshots."},
        "endpoint": {"type": "string", "pattern": "^$|^[a-z0-9]([a-z0-9-]{0,61}[a-z0-9])?(\\.[a-z0-9]([a-z0-9-]{0,61}[a-z0-9])?)*$", "description": "The S3 endpoint's host name. Default s3.eu-central-003.backblazeb2.com."},
        "b2_daily_budget": {"type": "integer", "minimum": 0, "maximum": 10000000, "description": "Class B and Class C transactions a day each that doctor and the dashboard measure B2 use against, warning at 70%. Default 2000."},
        "targets": {
          "type": ["array", "null"],
          "maxItems": 16,
          "description": "Backup targets besides the cloud: restic repositories in folders on nodes (docs/VAULT.md, Node targets). They run whether or not the vault is on.",
          "items": {
            "type": "object",
            "additionalProperties": false,
            "required": ["name", "kind", "node", "folder"],
            "properties": {
              "name": {"type": "string", "pattern": "^[a-z0-9][a-z0-9-]{0,31}$", "description": "brain.json names it as node:<name>."},
              "kind": {"type": "string", "enum": ["node"]},
              "node": {"type": "string", "pattern": "^[0-9a-f]{12}$", "description": "The node's id (fridolin nodes)."},
              "folder": {"type": "string", "description": "An absolute path on the node, in its own spelling."},
              "nightly_at": {"type": "string", "pattern": "^$|^([01][0-9]|2[0-3]):[0-5][0-9]$", "description": "HH:MM local time. Default 03:00."},
              "hourly": {"type": "boolean", "description": "A snapshot each hour besides the nightly one."},
              "include_data_dir": {"type": "boolean", "description": "The nightly snapshot takes the data dir too, less the brain folders that do not choose the target."},
              "retention": {
                "type": ["object", "null"],
                "additionalProperties": false,
                "description": "Default 24 hourly, 14 daily, 8 weekly, 12 monthly.",
                "properties": {
                  "hourly": {"type": "integer", "minimum": 0, "maximum": 100000},
                  "daily": {"type": "integer", "minimum": 0, "maximum": 100000},
                  "weekly": {"type": "integer", "minimum": 0, "maximum": 100000},
                  "monthly": {"type": "integer", "minimum": 0, "maximum": 100000}
                }
              },
              "check_days": {"type": "integer", "minimum": 0, "maximum": 36500, "description": "Default 7."},
              "read_data_days": {"type": "integer", "minimum": 0, "maximum": 36500, "description": "Default 30."},
              "window_hours": {"type": "integer", "minimum": 0, "maximum": 876000, "description": "How old the last snapshot may be before doctor warns. Default 26."}
            }
          }
        }
      }
    },
    "nodes": {
      "type": "object",
      "additionalProperties": false,
      "description": "The port nodes connect to. Off by default.",
      "properties": {
        "enabled": {"type": "boolean", "description": "Accept node connections. Needs a restart."},
        "listen": {"type": "string", "pattern": "^$|^([a-z0-9.-]*|\\[[0-9A-Fa-f:.]+\\]):([1-9][0-9]{0,3}|[1-5][0-9]{4}|6[0-4][0-9]{3}|65[0-4][0-9]{2}|655[0-2][0-9]|6553[0-5])$", "description": "host:port. Default :8766. Needs a restart."}
      }
    },
    "policy": {
      "type": "object",
      "additionalProperties": false,
      "description": "Limits on what brains do without asking.",
      "properties": {
        "max_runs_per_hour": {"type": "integer", "minimum": 0, "maximum": 10000, "description": "Default 20."},
        "max_pending_irreversible": {"type": "integer", "minimum": 0, "maximum": 1000, "description": "Default 3."},
        "approval_timeout_hours": {"type": "integer", "minimum": 0, "maximum": 720, "description": "Default 24."}
      }
    },
    "housekeeping": {
      "type": "object",
      "additionalProperties": false,
      "description": "The job that finds what the bridge and its children left running and stops what is the bridge's own.",
      "properties": {
        "enabled": {"type": "boolean", "description": "Run on the schedule. Default true."},
        "every_hours": {"type": "integer", "minimum": 0, "maximum": 8760, "description": "How often it runs. Default 48."},
        "dry_run": {"type": "boolean", "description": "Only report what it would stop or remove. Default true."},
        "cpu_percent": {"type": "integer", "minimum": 0, "maximum": 102400, "description": "CPU, in percent of one core, that makes a process heavy. Default 80."},
        "rss_mb": {"type": "integer", "minimum": 0, "maximum": 16777216, "description": "Resident memory in MB that makes a process heavy. Default 2048."},
        "min_age_minutes": {"type": "integer", "minimum": 0, "maximum": 10080, "description": "Processes younger than this are left alone. Default 60."}
      }
    },
    "schedules": {
      "type": "object",
      "additionalProperties": false,
      "description": "The scheduled agents of every brain (docs/BRAINS.md, Scheduled agents): whether they run on their schedules, how they are spread, and how much of their history and logs is kept.",
      "properties": {
        "enabled": {
          "type": "boolean",
          "description": "Run the agents on their schedules; Run now works either way. Default true."
        },
        "jitter_minutes": {
          "type": "integer",
          "minimum": 0,
          "maximum": 1440,
          "description": "Spread each agent's runs by a fixed offset within this many minutes, unless it sets its own. Default 2."
        },
        "keep_days": {
          "type": "integer",
          "minimum": 0,
          "maximum": 3650,
          "description": "Drop runs older than this from the history (each agent keeps its newest). Default 30."
        },
        "keep_runs": {
          "type": "integer",
          "minimum": 0,
          "maximum": 100000,
          "description": "Keep at most this many runs of each agent. Default 100."
        },
        "max_total_mb": {
          "type": "integer",
          "minimum": 0,
          "maximum": 1048576,
          "description": "Drop the oldest runs of all agents until their logs take no more than this. Default 200."
        },
        "max_log_kb": {
          "type": "integer",
          "minimum": 0,
          "maximum": 1048576,
          "description": "Cut one run's log at this size. Default 1024."
        }
      }
    },
    "model": {"type": "string", "deprecated": true, "description": "Retired in version 2: version 1's model, which becomes brain_model while that is empty."},
    "work_dir": {"type": "string", "deprecated": true, "description": "Retired in version 2: the folder classic mode ran in."},
    "brains": {"type": ["array", "null"], "maxItems": 0, "deprecated": true, "description": "Retired in version 2: inline brains, refused unless the list is empty."}
  },
  "$defs": {
    "bucket": {"type": "string", "pattern": "^$|^[a-z0-9][a-z0-9-]{4,61}[a-z0-9]$", "not": {"pattern": "^b2-"}, "description": "A B2 bucket name: 6 to 63 lower-case letters, digits and -, not starting with b2-."},
    "absolute_path": {"type": "string", "pattern": "^(/|~/|~$)", "description": "An absolute path, or one that starts with ~/."},
    "phone_number": {
      "type": "string",
      "pattern": "^[\\s+]*([ \u00a0().-]*[0-9]){6,15}[ \u00a0().-]*\\s*(@s\\.whatsapp\\.net\\s*)?$",
      "description": "6 to 15 digits with the country code, written as people write a number: a +, spaces, dashes, dots or brackets, or as its …@s.whatsapp.net JID."
    }
  }
}
